{
  "checks": [
    {
      "id": "spec-conformance-tests::generated_mdl_order_lifecycle::transition_cancelling_on_cancel_complete_to_cancelled",
      "model": "order-lifecycle",
      "plan_id": "transition_cancelling_on_cancel_complete_to_cancelled"
    },
    {
      "id": "spec-conformance-tests::generated_mdl_order_lifecycle::transition_pending_on_cancel_to_cancelling",
      "model": "order-lifecycle",
      "plan_id": "transition_pending_on_cancel_to_cancelling"
    },
    {
      "id": "spec-conformance-tests::generated_mdl_order_lifecycle::rejects_cancelled_on_cancel",
      "model": "order-lifecycle",
      "plan_id": "rejects_cancelled_on_cancel"
    },
    {
      "id": "spec-conformance-tests::generated_mdl_order_lifecycle::rejects_cancelled_on_cancel_complete",
      "model": "order-lifecycle",
      "plan_id": "rejects_cancelled_on_cancel_complete"
    },
    {
      "id": "spec-conformance-tests::generated_mdl_order_lifecycle::rejects_cancelling_on_cancel",
      "model": "order-lifecycle",
      "plan_id": "rejects_cancelling_on_cancel"
    },
    {
      "id": "spec-conformance-tests::generated_mdl_order_lifecycle::rejects_pending_on_cancel_complete",
      "model": "order-lifecycle",
      "plan_id": "rejects_pending_on_cancel_complete"
    },
    {
      "id": "spec-conformance-tests::generated_mdl_order_lifecycle::invariant_no_new_shipments_dispatched",
      "model": "order-lifecycle",
      "plan_id": "invariant_no_new_shipments_dispatched"
    }
  ],
  "contract_version": 1,
  "files": [
    {
      "content": "// GENERATED by spec-generate — DO NOT EDIT (regenerate and commit; hand-edits fail `spec-generate check`)\n\npub mod values_service_orders;\n",
      "path": "spec-conformance-tests/src/generated/mod.rs"
    },
    {
      "content": "// GENERATED by spec-generate — DO NOT EDIT (regenerate and commit; hand-edits fail `spec-generate check`)\n// source: spec/manifests/service-orders.manifest.yaml\n// manifest-hash: sha256:f1d9a3f4391c1fa2015e170781ebea2724773ae0b55c3424683dcc6cb9002e56\n//\n// Bound-source discipline (RU spec §5.3): application tests import these\n// instead of hardcoding numbers — a gated value change then fails loudly\n// instead of leaving a stale literal asserting the old bound.\n#![allow(dead_code)]\n\npub const RETENTION_DECISION_LOG_DAYS: u64 = 90;\n",
      "path": "spec-conformance-tests/src/generated/values_service_orders.rs"
    },
    {
      "content": "// GENERATED by spec-generate — DO NOT EDIT (regenerate and commit; hand-edits fail `spec-generate check`)\n// source: spec/models/MDL-order-lifecycle.statechart.json\n// model-hash: sha256:e3e73f60006278893ab0bb5a1225707014de51b5953855387b2dca04217a2a16\n// undeclared_event_policy: ignore\n//\n// Diagram-as-oracle (RU spec §6.3): code stays hand-owned, this suite is\n// generated. Every test is #[ignore]d until the application provides the\n// StatechartSubject shim for this model (plan D-P6.4) — running with\n// --ignored panics with the shim TODO rather than passing vacuously.\n// Test bodies are #[rustfmt::skip]: identifier lengths come from the\n// model, so rustfmt stability is declared, never chased per-name.\n\nuse spec_conformance_tests::statechart::{subject, Outcome};\n\nconst MODEL: &str = \"order-lifecycle\";\n\nfn shim() -> Box<dyn spec_conformance_tests::statechart::StatechartSubject> {\n    match subject(MODEL) {\n        Some(s) => s,\n        None => panic!(\"statechart shim for MDL-{MODEL} not implemented — application work\"),\n    }\n}\n\n#[test]\n#[ignore = \"statechart shim pending (application work) — see file header\"]\n#[rustfmt::skip]\nfn transition_cancelling_on_cancel_complete_to_cancelled() {\n    let outcome = shim().apply(\"cancelling\", \"CANCEL_COMPLETE\");\n    assert_eq!(outcome, Outcome::Transition(\"cancelled\".into()));\n}\n\n#[test]\n#[ignore = \"statechart shim pending (application work) — see file header\"]\n#[rustfmt::skip]\nfn transition_pending_on_cancel_to_cancelling() {\n    let outcome = shim().apply(\"pending\", \"CANCEL\");\n    assert_eq!(outcome, Outcome::Transition(\"cancelling\".into()));\n}\n\n#[test]\n#[ignore = \"statechart shim pending (application work) — see file header\"]\n#[rustfmt::skip]\nfn rejects_cancelled_on_cancel() {\n    let outcome = shim().apply(\"cancelled\", \"CANCEL\");\n    assert_eq!(outcome, Outcome::Ignored);\n}\n\n#[test]\n#[ignore = \"statechart shim pending (application work) — see file header\"]\n#[rustfmt::skip]\nfn rejects_cancelled_on_cancel_complete() {\n    let outcome = shim().apply(\"cancelled\", \"CANCEL_COMPLETE\");\n    assert_eq!(outcome, Outcome::Ignored);\n}\n\n#[test]\n#[ignore = \"statechart shim pending (application work) — see file header\"]\n#[rustfmt::skip]\nfn rejects_cancelling_on_cancel() {\n    let outcome = shim().apply(\"cancelling\", \"CANCEL\");\n    assert_eq!(outcome, Outcome::Ignored);\n}\n\n#[test]\n#[ignore = \"statechart shim pending (application work) — see file header\"]\n#[rustfmt::skip]\nfn rejects_pending_on_cancel_complete() {\n    let outcome = shim().apply(\"pending\", \"CANCEL_COMPLETE\");\n    assert_eq!(outcome, Outcome::Ignored);\n}\n\n#[test]\n#[ignore = \"statechart shim pending (application work) — see file header\"]\n#[rustfmt::skip]\nfn invariant_no_new_shipments_dispatched() {\n    assert!(shim().invariant_holds(\"cancelling\", \"no_new_shipments_dispatched\"));\n}\n",
      "path": "spec-conformance-tests/tests/generated_mdl_order_lifecycle.rs"
    }
  ],
  "generated_by": "rqunit-adapter-rust emit-suite 0.1.0"
}
