{
  "checks": [
    {
      "id": "spec-conformance-tests::generated_mdl_order_lifecycle::transition_cancelling_on_refund_settled_to_cancelled",
      "model": "order-lifecycle",
      "plan_id": "transition_cancelling_on_refund_settled_to_cancelled"
    },
    {
      "id": "spec-conformance-tests::generated_mdl_order_lifecycle::transition_placed_on_cancel_to_cancelling",
      "model": "order-lifecycle",
      "plan_id": "transition_placed_on_cancel_to_cancelling"
    },
    {
      "id": "spec-conformance-tests::generated_mdl_order_lifecycle::transition_placed_on_ship_to_shipped",
      "model": "order-lifecycle",
      "plan_id": "transition_placed_on_ship_to_shipped"
    },
    {
      "id": "spec-conformance-tests::generated_mdl_order_lifecycle::rejects_cancelled_on_cancel",
      "model": "order-lifecycle",
      "plan_id": "rejects_cancelled_on_cancel"
    },
    {
      "id": "spec-conformance-tests::generated_mdl_order_lifecycle::rejects_cancelled_on_refund_settled",
      "model": "order-lifecycle",
      "plan_id": "rejects_cancelled_on_refund_settled"
    },
    {
      "id": "spec-conformance-tests::generated_mdl_order_lifecycle::rejects_cancelled_on_ship",
      "model": "order-lifecycle",
      "plan_id": "rejects_cancelled_on_ship"
    },
    {
      "id": "spec-conformance-tests::generated_mdl_order_lifecycle::rejects_cancelling_on_cancel",
      "model": "order-lifecycle",
      "plan_id": "rejects_cancelling_on_cancel"
    },
    {
      "id": "spec-conformance-tests::generated_mdl_order_lifecycle::rejects_cancelling_on_ship",
      "model": "order-lifecycle",
      "plan_id": "rejects_cancelling_on_ship"
    },
    {
      "id": "spec-conformance-tests::generated_mdl_order_lifecycle::rejects_placed_on_refund_settled",
      "model": "order-lifecycle",
      "plan_id": "rejects_placed_on_refund_settled"
    },
    {
      "id": "spec-conformance-tests::generated_mdl_order_lifecycle::rejects_shipped_on_cancel",
      "model": "order-lifecycle",
      "plan_id": "rejects_shipped_on_cancel"
    },
    {
      "id": "spec-conformance-tests::generated_mdl_order_lifecycle::rejects_shipped_on_refund_settled",
      "model": "order-lifecycle",
      "plan_id": "rejects_shipped_on_refund_settled"
    },
    {
      "id": "spec-conformance-tests::generated_mdl_order_lifecycle::rejects_shipped_on_ship",
      "model": "order-lifecycle",
      "plan_id": "rejects_shipped_on_ship"
    },
    {
      "id": "spec-conformance-tests::generated_mdl_order_lifecycle::invariant_no_new_picks_dispatched",
      "model": "order-lifecycle",
      "plan_id": "invariant_no_new_picks_dispatched"
    }
  ],
  "contract_version": 1,
  "files": [
    {
      "content": "// GENERATED by spec-generate — DO NOT EDIT (regenerate and commit; hand-edits fail `spec-generate check`)\n\npub mod values_shared;\n",
      "path": "spec-conformance-tests/src/generated/mod.rs"
    },
    {
      "content": "// GENERATED by spec-generate — DO NOT EDIT (regenerate and commit; hand-edits fail `spec-generate check`)\n// source: spec/manifests/shared.manifest.yaml\n// manifest-hash: sha256:277e80d1c2d187da40bf7df676239e2ec8656a4f699c35a12138d5ad94fab4de\n//\n// Bound-source discipline (RU spec §5.3): application tests import these\n// instead of hardcoding numbers — a gated value change then fails loudly\n// instead of leaving a stale literal asserting the old bound.\n#![allow(dead_code)]\n\npub const FULFILMENT_HALT_SECONDS: u64 = 5;\npub const RETENTION_AUDIT_DAYS: u64 = 90;\n",
      "path": "spec-conformance-tests/src/generated/values_shared.rs"
    },
    {
      "content": "// GENERATED by spec-generate — DO NOT EDIT (regenerate and commit; hand-edits fail `spec-generate check`)\n// source: spec/models/MDL-order-lifecycle.statechart.json\n// model-hash: sha256:8d9f1f8a86f4c04fae5fd8c9f07259005c247caf0fe19e2f119c56d6cb507d1b\n// undeclared_event_policy: error\n//\n// Diagram-as-oracle (RU spec §6.3): code stays hand-owned, this suite is\n// generated. Every test is #[ignore]d until the application provides the\n// StatechartSubject shim for this model (plan D-P6.4) — running with\n// --ignored panics with the shim TODO rather than passing vacuously.\n// Test bodies are #[rustfmt::skip]: identifier lengths come from the\n// model, so rustfmt stability is declared, never chased per-name.\n\nuse spec_conformance_tests::statechart::{subject, Outcome};\n\nconst MODEL: &str = \"order-lifecycle\";\n\nfn shim() -> Box<dyn spec_conformance_tests::statechart::StatechartSubject> {\n    match subject(MODEL) {\n        Some(s) => s,\n        None => panic!(\"statechart shim for MDL-{MODEL} not implemented — application work\"),\n    }\n}\n\n#[test]\n#[ignore = \"statechart shim pending (application work) — see file header\"]\n#[rustfmt::skip]\nfn transition_cancelling_on_refund_settled_to_cancelled() {\n    let outcome = shim().apply(\"cancelling\", \"REFUND_SETTLED\");\n    assert_eq!(outcome, Outcome::Transition(\"cancelled\".into()));\n}\n\n#[test]\n#[ignore = \"statechart shim pending (application work) — see file header\"]\n#[rustfmt::skip]\nfn transition_placed_on_cancel_to_cancelling() {\n    let outcome = shim().apply(\"placed\", \"CANCEL\");\n    assert_eq!(outcome, Outcome::Transition(\"cancelling\".into()));\n}\n\n#[test]\n#[ignore = \"statechart shim pending (application work) — see file header\"]\n#[rustfmt::skip]\nfn transition_placed_on_ship_to_shipped() {\n    let outcome = shim().apply(\"placed\", \"SHIP\");\n    assert_eq!(outcome, Outcome::Transition(\"shipped\".into()));\n}\n\n#[test]\n#[ignore = \"statechart shim pending (application work) — see file header\"]\n#[rustfmt::skip]\nfn rejects_cancelled_on_cancel() {\n    let outcome = shim().apply(\"cancelled\", \"CANCEL\");\n    assert_eq!(outcome, Outcome::Error);\n}\n\n#[test]\n#[ignore = \"statechart shim pending (application work) — see file header\"]\n#[rustfmt::skip]\nfn rejects_cancelled_on_refund_settled() {\n    let outcome = shim().apply(\"cancelled\", \"REFUND_SETTLED\");\n    assert_eq!(outcome, Outcome::Error);\n}\n\n#[test]\n#[ignore = \"statechart shim pending (application work) — see file header\"]\n#[rustfmt::skip]\nfn rejects_cancelled_on_ship() {\n    let outcome = shim().apply(\"cancelled\", \"SHIP\");\n    assert_eq!(outcome, Outcome::Error);\n}\n\n#[test]\n#[ignore = \"statechart shim pending (application work) — see file header\"]\n#[rustfmt::skip]\nfn rejects_cancelling_on_cancel() {\n    let outcome = shim().apply(\"cancelling\", \"CANCEL\");\n    assert_eq!(outcome, Outcome::Error);\n}\n\n#[test]\n#[ignore = \"statechart shim pending (application work) — see file header\"]\n#[rustfmt::skip]\nfn rejects_cancelling_on_ship() {\n    let outcome = shim().apply(\"cancelling\", \"SHIP\");\n    assert_eq!(outcome, Outcome::Error);\n}\n\n#[test]\n#[ignore = \"statechart shim pending (application work) — see file header\"]\n#[rustfmt::skip]\nfn rejects_placed_on_refund_settled() {\n    let outcome = shim().apply(\"placed\", \"REFUND_SETTLED\");\n    assert_eq!(outcome, Outcome::Error);\n}\n\n#[test]\n#[ignore = \"statechart shim pending (application work) — see file header\"]\n#[rustfmt::skip]\nfn rejects_shipped_on_cancel() {\n    let outcome = shim().apply(\"shipped\", \"CANCEL\");\n    assert_eq!(outcome, Outcome::Error);\n}\n\n#[test]\n#[ignore = \"statechart shim pending (application work) — see file header\"]\n#[rustfmt::skip]\nfn rejects_shipped_on_refund_settled() {\n    let outcome = shim().apply(\"shipped\", \"REFUND_SETTLED\");\n    assert_eq!(outcome, Outcome::Error);\n}\n\n#[test]\n#[ignore = \"statechart shim pending (application work) — see file header\"]\n#[rustfmt::skip]\nfn rejects_shipped_on_ship() {\n    let outcome = shim().apply(\"shipped\", \"SHIP\");\n    assert_eq!(outcome, Outcome::Error);\n}\n\n#[test]\n#[ignore = \"statechart shim pending (application work) — see file header\"]\n#[rustfmt::skip]\nfn invariant_no_new_picks_dispatched() {\n    assert!(shim().invariant_holds(\"cancelling\", \"no_new_picks_dispatched\"));\n}\n",
      "path": "spec-conformance-tests/tests/generated_mdl_order_lifecycle.rs"
    }
  ],
  "generated_by": "rqunit-adapter-rust emit-suite 0.1.0"
}
